{
  "schemaVersion": 1,
  "catalogVersion": "4.0.0-alpha.1",
  "runtimeContractVersion": "1.0",
  "runtimeSource": { "command": "yeelight-home invoke --stdin", "contract": "intent-schema-and-runtime-probe" },
  "statuses": ["read-proven", "preview-proven", "write-proven", "read-only", "unsupported", "version-mismatch"],
  "capabilities": [
    { "id": "home.read", "resource": "home", "intent": "home.list", "operation": "read", "risk": "R0", "fixtureIds": ["990001"], "handlerId": "home.list", "probeId": "home-list", "uiConsumer": "home-overview", "selector": { "scope": "account" }, "parameters": { "type": "object" }, "minimumCliVersion": "0.1.21", "evidenceStrategy": "read" },
    { "id": "area.read", "resource": "area", "intent": "entity.list", "operation": "read", "risk": "R0", "fixtureIds": ["990101"], "handlerId": "entity.area-list", "probeId": "entity-list", "uiConsumer": "area-directory", "selector": { "entityType": "area" }, "parameters": { "type": "object", "required": ["houseId"] }, "minimumCliVersion": "0.1.21", "evidenceStrategy": "read" },
    { "id": "room.read", "resource": "room", "intent": "room.list", "operation": "read", "risk": "R0", "fixtureIds": ["991001"], "handlerId": "room.list", "probeId": "room-list", "uiConsumer": "room-directory", "selector": { "entityType": "room" }, "parameters": { "type": "object", "required": ["houseId"] }, "minimumCliVersion": "0.1.21", "evidenceStrategy": "read" },
    { "id": "device.directory.read", "resource": "device", "intent": "device.list", "operation": "read", "risk": "R0", "fixtureIds": ["992001"], "handlerId": "device.list", "probeId": "device-list", "uiConsumer": "device-directory", "selector": { "entityType": "device" }, "parameters": { "type": "object", "required": ["houseId"] }, "minimumCliVersion": "0.1.21", "evidenceStrategy": "read" },
    { "id": "device.detail.read", "resource": "device", "intent": "device.detail.get", "operation": "read", "risk": "R0", "fixtureIds": ["992001"], "handlerId": "device.detail", "probeId": "device-detail", "uiConsumer": "device-detail", "selector": { "entityType": "device" }, "parameters": { "type": "object", "required": ["houseId", "deviceId"] }, "minimumCliVersion": "0.1.21", "evidenceStrategy": "read" },
    { "id": "device.state.read", "resource": "device", "intent": "state.query", "operation": "read", "risk": "R0", "fixtureIds": ["992001"], "handlerId": "device.state", "probeId": "device-state", "uiConsumer": "device-state", "selector": { "entityType": "device", "requires": ["properties"] }, "parameters": { "type": "object", "required": ["houseId", "deviceId"] }, "minimumCliVersion": "0.1.21", "evidenceStrategy": "read" },
    { "id": "light.power.write", "resource": "light", "intent": "light.power.set", "operation": "write", "risk": "R1", "fixtureIds": ["992001"], "handlerId": "device.property.write", "probeId": "light-power-preview", "uiConsumer": "device-light-controller", "previewRequired": true, "selector": { "family": "light", "requires": ["power"] }, "parameters": { "type": "object", "required": ["houseId", "power"] }, "minimumCliVersion": "0.1.21", "evidenceStrategy": "mock-write-readback-restore" },
    { "id": "light.brightness.write", "resource": "light", "intent": "light.brightness.set", "operation": "write", "risk": "R1", "fixtureIds": ["992001"], "handlerId": "device.property.write", "probeId": "light-brightness-preview", "uiConsumer": "device-light-controller", "previewRequired": true, "selector": { "family": "light", "requires": ["brightness"] }, "parameters": { "type": "object", "required": ["houseId", "brightness"] }, "minimumCliVersion": "0.1.21", "evidenceStrategy": "mock-write-readback-restore" },
    { "id": "light.color-temperature.write", "resource": "light", "intent": "light.color_temperature.set", "operation": "write", "risk": "R1", "fixtureIds": ["992002"], "handlerId": "device.property.write", "probeId": "light-ct-preview", "uiConsumer": "device-light-controller", "previewRequired": true, "selector": { "family": "light", "requires": ["colorTemperature"] }, "parameters": { "type": "object", "required": ["houseId", "colorTemperature"] }, "minimumCliVersion": "0.1.21", "evidenceStrategy": "mock-write-readback-restore" },
    { "id": "light.color.write", "resource": "light", "intent": "light.color.set", "operation": "write", "risk": "R1", "fixtureIds": ["992003"], "handlerId": "device.property.write", "probeId": "light-color-preview", "uiConsumer": "device-light-controller", "previewRequired": true, "selector": { "family": "light", "requires": ["color"] }, "parameters": { "type": "object", "required": ["houseId", "color"] }, "minimumCliVersion": "0.1.21", "evidenceStrategy": "mock-write-readback-restore" },
    { "id": "curtain.position.write", "resource": "device", "intent": "device.property.set", "operation": "write", "risk": "R1", "fixtureIds": ["992101"], "handlerId": "device.property.write", "probeId": "curtain-position-preview", "uiConsumer": "device-curtain-controller", "previewRequired": true, "selector": { "family": "curtain", "requires": ["targetPosition"] }, "parameters": { "type": "object", "required": ["houseId", "deviceId", "property", "value"] }, "minimumCliVersion": "0.1.21", "evidenceStrategy": "mock-write-readback-restore" },
    { "id": "relay.circuit.write", "resource": "device", "intent": "device.property.set", "operation": "write", "risk": "R1", "fixtureIds": ["992201"], "handlerId": "device.property.write", "probeId": "relay-circuit-preview", "uiConsumer": "device-relay-controller", "previewRequired": true, "selector": { "family": "switch-relay", "requires": ["sp"] }, "parameters": { "type": "object", "required": ["houseId", "deviceId", "property", "value"] }, "minimumCliVersion": "0.1.21", "evidenceStrategy": "mock-write-readback-restore" },
    { "id": "climate.control.write", "resource": "device", "intent": "device.property.set", "operation": "write", "risk": "R1", "fixtureIds": ["992301"], "handlerId": "device.property.write", "probeId": "climate-preview", "uiConsumer": "device-climate-controller", "previewRequired": true, "selector": { "family": "climate", "requires": ["actt"] }, "parameters": { "type": "object", "required": ["houseId", "deviceId", "property", "value"] }, "minimumCliVersion": "0.1.21", "evidenceStrategy": "mock-write-readback-restore" },
    { "id": "sensor.environment.read", "resource": "sensor", "intent": "sensor.list", "operation": "read", "risk": "R0", "fixtureIds": ["992401", "992405"], "handlerId": "sensor.list", "probeId": "sensor-list", "uiConsumer": "environment-dashboard", "selector": { "family": "sensor", "traits": ["environment"] }, "parameters": { "type": "object", "required": ["houseId"] }, "minimumCliVersion": "0.1.21", "evidenceStrategy": "read" },
    { "id": "sensor.security.read", "resource": "sensor", "intent": "sensor.event.list", "operation": "read", "risk": "R0", "fixtureIds": ["992402", "992403", "992404"], "handlerId": "sensor.events", "probeId": "sensor-events", "uiConsumer": "security-status", "selector": { "family": "sensor", "traits": ["security"] }, "parameters": { "type": "object", "required": ["houseId"] }, "minimumCliVersion": "0.1.21", "evidenceStrategy": "read" },
    { "id": "scene.read", "resource": "scene", "intent": "scene.list", "operation": "read", "risk": "R0", "fixtureIds": ["994001"], "handlerId": "scene.list", "probeId": "scene-list", "uiConsumer": "scene-directory", "selector": { "entityType": "scene" }, "parameters": { "type": "object", "required": ["houseId"] }, "minimumCliVersion": "0.1.21", "evidenceStrategy": "read" },
    { "id": "scene.detail.read", "resource": "scene", "intent": "scene.detail.get", "operation": "read", "risk": "R0", "fixtureIds": ["994001"], "handlerId": "scene.detail", "probeId": "scene-detail", "uiConsumer": "scene-detail", "selector": { "entityType": "scene" }, "parameters": { "type": "object", "required": ["houseId", "sceneId"] }, "minimumCliVersion": "0.1.21", "evidenceStrategy": "read" },
    { "id": "scene.create", "resource": "scene", "intent": "scene.create", "operation": "write", "risk": "R2", "fixtureIds": ["994001"], "handlerId": "scene.create", "probeId": "scene-create-preview", "uiConsumer": "scene-editor", "previewRequired": true, "selector": { "entityType": "scene" }, "parameters": { "type": "object", "required": ["houseId", "name", "actions"] }, "minimumCliVersion": "0.1.21", "evidenceStrategy": "mock-write-readback-restore" },
    { "id": "scene.update", "resource": "scene", "intent": "scene.update", "operation": "write", "risk": "R2", "fixtureIds": ["994001"], "handlerId": "scene.update", "probeId": "scene-update-preview", "uiConsumer": "scene-editor", "previewRequired": true, "selector": { "entityType": "scene" }, "parameters": { "type": "object", "required": ["houseId", "sceneId", "actions"] }, "minimumCliVersion": "0.1.21", "evidenceStrategy": "mock-write-readback-restore" },
    { "id": "scene.test", "resource": "scene", "intent": "scene.test", "operation": "write", "risk": "R1", "fixtureIds": ["994001"], "handlerId": "scene.test", "probeId": "scene-test-preview", "uiConsumer": "scene-editor", "previewRequired": true, "selector": { "entityType": "scene" }, "parameters": { "type": "object", "required": ["houseId", "sceneId"] }, "minimumCliVersion": "0.1.21", "evidenceStrategy": "mock-write-readback-restore" },
    { "id": "scene.execute", "resource": "scene", "intent": "scene.execute", "operation": "write", "risk": "R1", "fixtureIds": ["994001"], "handlerId": "scene.execute", "probeId": "scene-preview", "uiConsumer": "scene-launcher", "previewRequired": true, "selector": { "entityType": "scene" }, "parameters": { "type": "object", "required": ["houseId", "sceneId"] }, "minimumCliVersion": "0.1.21", "evidenceStrategy": "mock-write-readback-restore" },